{
  "case_id": "CASE_15",
  "candidate_id": "C15",
  "display_name": "C15",
  "created_at": "2026-06-17T21:43:37.401642",
  "source": "abaqus_auto",
  "task": {
    "application": "复合材料外压圆柱耐压壳",
    "load_conditions": {
      "type": "external_pressure",
      "label": "外部静水压力",
      "external_pressure_MPa": 30.0
    },
    "boundary_conditions": {
      "type": "END_CLAMPED",
      "label": "两端固支",
      "description": "圆柱耐压壳两端截面平动与转动约束，用于基准外压屈曲与后屈曲校核。",
      "axial_edges": [
        "X0",
        "X1"
      ],
      "radial_constraint": true,
      "rotation_constraint": true
    },
    "geometry_envelope": {
      "length_mm": [
        300.0,
        800.0
      ],
      "radius_mm": [
        80.0,
        180.0
      ],
      "thickness_mm": [
        5.0,
        20.0
      ],
      "alpha_deg": [
        10.0,
        80.0
      ],
      "beta_deg": [
        10.0,
        80.0
      ],
      "imperfection_ratio": [
        0.001,
        0.01
      ]
    },
    "material_system": {
      "name": "T700/Epoxy",
      "density_kg_per_m3": 1550,
      "E1_GPa": 102.0,
      "E2_GPa": 7.0,
      "G12_GPa": 3.35,
      "nu12": 0.16,
      "Xt_MPa": 1400,
      "Xc_MPa": 1050,
      "Yt_MPa": 28,
      "Yc_MPa": 105,
      "S_MPa": 75,
      "material_key": "T700_Epoxy",
      "is_user_specified": false
    },
    "layup_constraints": {
      "allowed_angles": [
        0,
        45,
        -45,
        90
      ],
      "symmetric": true,
      "balanced": true,
      "min_ratio_per_angle": 0.05
    },
    "candidate_generation_preferences": {
      "total_candidates": 2,
      "llm_candidates": null,
      "case_transfer_candidates": null,
      "doe_candidates": null,
      "source_allocation_mode": "ratio_2_1_1"
    },
    "screening_preferences": {
      "top_k_candidates": 1
    },
    "hull_type": "CYLINDRICAL",
    "design_targets": {
      "ultimate_pressure_min_MPa": 35.0,
      "primary_objective": "最小壳体质量"
    }
  },
  "design": {
    "candidate_id": "C15",
    "display_name": "C15",
    "source": "LLM",
    "hull_type": "CYLINDRICAL",
    "geometry": {
      "length_mm": 600.0,
      "radius_mm": 120.0,
      "thickness_mm": 12.0,
      "alpha_deg": 30.0,
      "beta_deg": 60.0,
      "imperfection_ratio": 0.005
    },
    "layup": {
      "template_name": "BASE_90_AB",
      "layup": "[90_4/(±30/±60)_8/90_4]",
      "skin_layup": "[90_4/(±30/±60)_8/90_4]",
      "alpha_deg": 30.0,
      "beta_deg": 60.0,
      "ply_count": 40,
      "angles_deg": [
        90.0,
        90.0,
        90.0,
        90.0,
        30.0,
        -30.0,
        60.0,
        -60.0,
        30.0,
        -30.0,
        60.0,
        -60.0,
        30.0,
        -30.0,
        60.0,
        -60.0,
        30.0,
        -30.0,
        60.0,
        -60.0,
        30.0,
        -30.0,
        60.0,
        -60.0,
        30.0,
        -30.0,
        60.0,
        -60.0,
        30.0,
        -30.0,
        60.0,
        -60.0,
        30.0,
        -30.0,
        60.0,
        -60.0,
        90.0,
        90.0,
        90.0,
        90.0
      ],
      "skin_f0": 0.0,
      "skin_f45": 0.0,
      "skin_f90": 0.2
    },
    "material_system": {
      "name": "T700/Epoxy",
      "density_kg_per_m3": 1550.0,
      "E1_GPa": 102.0,
      "E2_GPa": 7.0,
      "G12_GPa": 3.35,
      "nu12": 0.16,
      "Xt_MPa": 1400.0,
      "Xc_MPa": 1050.0,
      "Yt_MPa": 28.0,
      "Yc_MPa": 105.0,
      "S_MPa": 75.0,
      "material_key": "T700_Epoxy"
    },
    "load_conditions": {
      "type": "external_pressure",
      "label": "外部静水压力",
      "external_pressure_MPa": 30.0
    },
    "boundary_conditions": {
      "type": "END_CLAMPED",
      "label": "两端固支",
      "description": "圆柱耐压壳两端截面平动与转动约束，用于基准外压屈曲与后屈曲校核。",
      "axial_edges": [
        "X0",
        "X1"
      ],
      "radial_constraint": true,
      "rotation_constraint": true
    },
    "design_targets": {
      "ultimate_pressure_min_MPa": 35.0,
      "primary_objective": "最小壳体质量"
    },
    "rule_check": {
      "is_valid": true,
      "errors": [],
      "suggestions": [],
      "details": {
        "length_mm_ok": true,
        "radius_mm_ok": true,
        "thickness_mm_ok": true,
        "alpha_deg_ok": true,
        "beta_deg_ok": true,
        "imperfection_ratio_ok": true,
        "slenderness_ok": true,
        "thickness_radius_ratio_ok": true,
        "imperfection_positive_ok": true,
        "layup_defined": true,
        "ply_count_ok": true,
        "balanced": true,
        "angle_range_ok": true,
        "solver_length_ok": true,
        "solver_radius_ok": true,
        "solver_thickness_ok": true,
        "solver_imperfection_ok": true
      }
    },
    "surrogate_ultimate_pressure_MPa": 91.895,
    "surrogate_PBIPF_MPa": 91.895,
    "surrogate_uncertainty_MPa": 6.111,
    "asme_linear_buckling_pressure_MPa": 29.779,
    "linear_buckling_source": "ASME RD-1172线性屈曲公式",
    "surrogate_weight": 18.6,
    "rationale": "环向/轴向刚度折中较好，缺陷比控制在 0.5‰ 降低屈曲风险，但 ±30/±60 铺层对缠绕角偏差敏感，需严格工艺控制",
    "origin_summary": "| 1 | T700/Epoxy | 600 | 120 | 12 | 30 | 60 | 0.005 | [90_4/(±30/±60)_8/90_4] | 环向/轴向刚度折中较好，缺陷比控制在 0.5‰ 降低屈曲风险，但 ±30/±60 铺层对缠绕角偏差敏感，需严格工艺控制 |",
    "llm_output_excerpt": "| 编号 | 材料 | 长度(mm) | 半径(mm) | 厚度(mm) | alpha(deg) | beta(deg) | 缺陷比 | 铺层形式 | 推荐理由 |\n|------|------|----------|----------|----------|------------|-----------|--------|----------|----------|\n| 1 | T700/Epoxy | 600 | 120 | 12 | 30 | 60 | 0.005 | [90_4/(±30/±60)_8/90_4] | 环向/轴向刚度折中较好，缺陷比控制在 0.5‰ 降低屈曲风险，但 ±30/±60 铺层对缠绕角偏差敏感，需严格工艺控制 |\n\n**工程说明：**\n1. 材料 T700/Epoxy 成本效率高，适合批量耐压壳；若追求更高极限强度可换 T800G/5228。\n2. 铺层形式 [90_4/(±30/±60)_8/90_4] 中 90° 层提供环向抗压刚度，±30/±60 层兼顾轴向和剪切稳定性。\n3. 缺陷比 0.005 对应 5‰，在缠绕工艺中可通过张力控制和固化后检测实现，但需增加无损检测成本。",
    "session_candidate_id": "TMP_1"
  },
  "abaqus_results": {
    "candidate_id": "C15",
    "session_candidate_id": "TMP_1",
    "display_name": "C15",
    "status": "success",
    "retry_count": 0,
    "ultimate_pressure_MPa": 53.418651,
    "failure_pressure_MPa": 53.418651,
    "linear_buckling_pressure_MPa": 43.785,
    "first_mode_eigenvalue": 43.785,
    "postbuckling_pressure_MPa": 53.418651,
    "postbuckling_reference_pressure_MPa": 40.0,
    "postbuckling_last_pressure_MPa": 53.418651,
    "riks_lpf_max": 1.33546627,
    "riks_lpf_last": 1.33546627,
    "riks_time_at_lpf_max": 21.51781273,
    "riks_time_last": 21.51781273,
    "imperfection_amplitude_mm": 0.63,
    "ultimate_pressure_basis": "一阶屈曲模态缺陷 Static Riks 最大 LPF × 基准外压",
    "failure_mode": "非线性后屈曲极限点",
    "max_displacement_mm": 47.302097,
    "weight_kg_per_m2": 18.6,
    "verdict": "通过",
    "abaqus_odb": "D:\\Project\\VS_Code\\CSDM_cph\\data\\abaqus_runs\\C15\\C15_post.odb",
    "linear_buckling_odb": "D:\\Project\\VS_Code\\CSDM_cph\\data\\abaqus_runs\\C15\\C15.odb",
    "postbuckling_odb": "D:\\Project\\VS_Code\\CSDM_cph\\data\\abaqus_runs\\C15\\C15_post.odb",
    "abaqus_inp": "D:\\Project\\VS_Code\\CSDM_cph\\data\\abaqus_runs\\C15\\C15.inp",
    "postbuckling_inp": "D:\\Project\\VS_Code\\CSDM_cph\\data\\abaqus_runs\\C15\\C15_post.inp",
    "visualization_json": "D:\\Project\\VS_Code\\CSDM_cph\\data\\abaqus_runs\\C15\\C15_mode1.json",
    "artifact_dir": "D:\\Project\\VS_Code\\CSDM_cph\\data\\abaqus_runs\\C15",
    "error_type": null,
    "error_log": null,
    "mode_eigenvalues": [
      43.785
    ],
    "load_summary": "外部静水压力：p=30.0 MPa",
    "boundary_summary": "两端固支",
    "diagnosis_summary": "外压圆柱壳有限元校核已完成，线性屈曲压力 43.785 MPa；极限压力按“一阶屈曲模态缺陷 Static Riks 最大 LPF × 基准外压”计算，基准外压 40.0 MPa，最大 LPF=1.33546627，得到极限压力 53.418651 MPa，当前结论为“通过”。",
    "analysis_type": "linear_buckling_plus_first_mode_imperfection_riks",
    "user_subroutine_used": false
  },
  "verdict": "通过",
  "surrogate_pressure_error_pct": 72.028,
  "fem_agent_retry_count": 0,
  "task_id": "TASK_535",
  "session_candidate_id": "TMP_1"
}