{
  "case_id": "CASE_19",
  "candidate_id": "C19",
  "display_name": "C19",
  "created_at": "2026-06-25T22:34:08.920865",
  "source": "abaqus_auto",
  "task": {
    "application": "复合材料外压圆柱耐压壳",
    "load_conditions": {
      "type": "external_pressure",
      "label": "外部静水压力",
      "external_pressure_MPa": 30.0
    },
    "boundary_conditions": {
      "type": "END_CLAMPED",
      "label": "两端固支",
      "description": "圆柱耐压壳两端截面平动与转动约束，用于基准外压屈曲与后屈曲校核。",
      "axial_edges": [
        "X0",
        "X1"
      ],
      "radial_constraint": true,
      "rotation_constraint": true
    },
    "geometry_envelope": {
      "length_mm": [
        300.0,
        800.0
      ],
      "radius_mm": [
        80.0,
        180.0
      ],
      "thickness_mm": [
        5.0,
        20.0
      ],
      "alpha_deg": [
        10.0,
        80.0
      ],
      "beta_deg": [
        10.0,
        80.0
      ],
      "imperfection_ratio": [
        0.001,
        0.01
      ]
    },
    "material_system": {
      "name": "T700/Epoxy",
      "density_kg_per_m3": 1550,
      "E1_GPa": 102.0,
      "E2_GPa": 7.0,
      "G12_GPa": 3.35,
      "nu12": 0.16,
      "Xt_MPa": 1400,
      "Xc_MPa": 1050,
      "Yt_MPa": 28,
      "Yc_MPa": 105,
      "S_MPa": 75,
      "material_key": "T700_Epoxy",
      "is_user_specified": false
    },
    "layup_constraints": {
      "allowed_angles": [
        0,
        45,
        -45,
        90
      ],
      "symmetric": true,
      "balanced": true,
      "min_ratio_per_angle": 0.05
    },
    "candidate_generation_preferences": {
      "total_candidates": 8,
      "llm_candidates": null,
      "case_transfer_candidates": null,
      "doe_candidates": null,
      "source_allocation_mode": "ratio_2_1_1"
    },
    "screening_preferences": {
      "top_k_candidates": 3
    },
    "hull_type": "CYLINDRICAL",
    "design_targets": {
      "ultimate_pressure_min_MPa": 35.0,
      "primary_objective": "最小壳体质量"
    }
  },
  "design": {
    "candidate_id": "C19",
    "display_name": "C19",
    "source": "CASE_TRANSFER",
    "hull_type": "CYLINDRICAL",
    "geometry": {
      "length_mm": 700.0,
      "radius_mm": 130.0,
      "thickness_mm": 15.0,
      "alpha_deg": 50.0,
      "beta_deg": 80.0,
      "imperfection_ratio": 0.01
    },
    "layup": {
      "template_name": "BASE_90_AB",
      "layup": "[(±50/±80)_10]",
      "skin_layup": "[(±50/±80)_10]",
      "alpha_deg": 50.0,
      "beta_deg": 80.0,
      "ply_count": 40,
      "angles_deg": [
        50.0,
        -50.0,
        80.0,
        -80.0,
        50.0,
        -50.0,
        80.0,
        -80.0,
        50.0,
        -50.0,
        80.0,
        -80.0,
        50.0,
        -50.0,
        80.0,
        -80.0,
        50.0,
        -50.0,
        80.0,
        -80.0,
        50.0,
        -50.0,
        80.0,
        -80.0,
        50.0,
        -50.0,
        80.0,
        -80.0,
        50.0,
        -50.0,
        80.0,
        -80.0,
        50.0,
        -50.0,
        80.0,
        -80.0,
        50.0,
        -50.0,
        80.0,
        -80.0
      ],
      "skin_f0": 0.0,
      "skin_f45": 0.0,
      "skin_f90": 0.0
    },
    "material_system": {
      "name": "T700/Epoxy",
      "density_kg_per_m3": 1550.0,
      "E1_GPa": 102.0,
      "E2_GPa": 7.0,
      "G12_GPa": 3.35,
      "nu12": 0.16,
      "Xt_MPa": 1400.0,
      "Xc_MPa": 1050.0,
      "Yt_MPa": 28.0,
      "Yc_MPa": 105.0,
      "S_MPa": 75.0,
      "material_key": "T700_Epoxy"
    },
    "load_conditions": {
      "type": "external_pressure",
      "label": "外部静水压力",
      "external_pressure_MPa": 30.0
    },
    "boundary_conditions": {
      "type": "END_CLAMPED",
      "label": "两端固支",
      "description": "圆柱耐压壳两端截面平动与转动约束，用于基准外压屈曲与后屈曲校核。",
      "axial_edges": [
        "X0",
        "X1"
      ],
      "radial_constraint": true,
      "rotation_constraint": true
    },
    "design_targets": {
      "ultimate_pressure_min_MPa": 35.0,
      "primary_objective": "最小壳体质量"
    },
    "rule_check": {
      "is_valid": true,
      "errors": [],
      "suggestions": [],
      "details": {
        "length_mm_ok": true,
        "radius_mm_ok": true,
        "thickness_mm_ok": true,
        "alpha_deg_ok": true,
        "beta_deg_ok": true,
        "imperfection_ratio_ok": true,
        "slenderness_ok": true,
        "thickness_radius_ratio_ok": true,
        "imperfection_positive_ok": true,
        "layup_defined": true,
        "ply_count_ok": true,
        "balanced": true,
        "angle_range_ok": true,
        "solver_length_ok": true,
        "solver_radius_ok": true,
        "solver_thickness_ok": true,
        "solver_imperfection_ok": true
      }
    },
    "surrogate_ultimate_pressure_MPa": 106.937,
    "surrogate_PBIPF_MPa": 106.937,
    "surrogate_uncertainty_MPa": 6.111,
    "asme_linear_buckling_pressure_MPa": 36.071,
    "linear_buckling_source": "ASME RD-1172线性屈曲公式",
    "surrogate_weight": 23.25,
    "rationale": "参考历史案例 CASE_17 并按当前任务约束迁移",
    "origin_summary": "| 4 | T700/Epoxy | 700 | 130 | 15 | 50 | 80 | 0.010 | [(±50/±80)_10] | 厚度较大，适合高外压；铺层角50°/80°接近环向，但缺陷控制风险较高。 |",
    "llm_output_excerpt": "好的，我将根据用户提供的工程任务和知识库信息，生成4个复合材料耐压壳的初始候选方案。这些方案基于项目材料库和可解析的铺层形式，考虑了外压30.0 MPa和极限压力目标35.0 MPa的要求。\n\n| 编号 | 材料 | 长度(mm) | 半径(mm) | 厚度(mm) | alpha(deg) | beta(deg) | 缺陷比 | 铺层形式 | 推荐理由 |\n|------|------|----------|----------|----------|------------|-----------|--------|----------|----------|\n| 1 | T700/Epoxy | 500 | 120 | 10 | 30 | 60 | 0.005 | [90_4/(±30/±60)_8/90_4] | 环向刚度较高，适合外压环境；铺层角30°/60°平衡轴向和环向性能，但对缺陷敏感性中等。 |\n| 2 | T800G/5228 | 600 | 100 | 12 | 45 | 75 | 0.008 | [(±45/±75)_10] | 高强度材料，适合深海应用；铺层角45°/75°提供良好的剪切性能，但制造成本较高。 |\n| 3 | M40J/TDE-85 | 400 | 150 | 8 | 20 | 50 | 0.003 | [90_4/(±20/±50)_8/90_4] | 高模量材料，适合需要高刚度的场景；铺层角20°/50°优化屈曲稳定性，但对缠绕工艺要求高。 |\n| 4 | T700/Epoxy | 700 | 130 | 15 | 50 | 80 | 0.010 | [(±50/±80)_10] | 厚度较大，适合高外压；铺层角50°/80°接近环向，但缺陷控制风险较高。 |\n\n**工程说明：**\n1. 材料选择基于项目知识库中的纤维缠绕和树脂传递模塑工艺要求，T700/Epoxy为常用材料，T800G/5228和M40J/TDE-85为高性能材料。\n2. 铺层形式参考了可解析的[90_4/(±alpha/±beta)_8/90_4]和[(±alpha/±beta)_10]结构，平衡了环向和轴向刚度。\n3. 缺陷比基于制造工艺的典型范围（0.001-0.01），但需通过实际制造验证。\n4. 所有候选方案需通过有限元分析（FEM）复核屈曲压力和强度，确保满足35.0 MPa的极限压力目标。",
    "session_candidate_id": "TMP_5"
  },
  "abaqus_results": {
    "candidate_id": "C19",
    "session_candidate_id": "TMP_5",
    "display_name": "C19",
    "status": "success",
    "retry_count": 0,
    "ultimate_pressure_MPa": 37.969005,
    "failure_pressure_MPa": 37.969005,
    "linear_buckling_pressure_MPa": 41.156,
    "first_mode_eigenvalue": 41.156,
    "postbuckling_pressure_MPa": 37.969005,
    "postbuckling_reference_pressure_MPa": 40.0,
    "postbuckling_last_pressure_MPa": 37.076876,
    "riks_lpf_max": 0.94922513,
    "riks_lpf_last": 0.9269219,
    "riks_time_at_lpf_max": 11.71781254,
    "riks_time_last": 21.51781273,
    "imperfection_amplitude_mm": 1.375,
    "ultimate_pressure_basis": "一阶屈曲模态缺陷 Static Riks 最大 LPF × 基准外压",
    "failure_mode": "非线性后屈曲极限点",
    "max_displacement_mm": 24.70478,
    "weight_kg_per_m2": 23.25,
    "verdict": "通过",
    "abaqus_odb": "D:\\Project\\VS_Code\\CSDM_cph\\data\\abaqus_runs\\C19\\C19_post.odb",
    "linear_buckling_odb": "D:\\Project\\VS_Code\\CSDM_cph\\data\\abaqus_runs\\C19\\C19.odb",
    "postbuckling_odb": "D:\\Project\\VS_Code\\CSDM_cph\\data\\abaqus_runs\\C19\\C19_post.odb",
    "abaqus_inp": "D:\\Project\\VS_Code\\CSDM_cph\\data\\abaqus_runs\\C19\\C19.inp",
    "postbuckling_inp": "D:\\Project\\VS_Code\\CSDM_cph\\data\\abaqus_runs\\C19\\C19_post.inp",
    "visualization_json": "D:\\Project\\VS_Code\\CSDM_cph\\data\\abaqus_runs\\C19\\C19_mode1.json",
    "artifact_dir": "D:\\Project\\VS_Code\\CSDM_cph\\data\\abaqus_runs\\C19",
    "error_type": null,
    "error_log": null,
    "mode_eigenvalues": [
      41.156
    ],
    "load_summary": "外部静水压力：p=30.0 MPa",
    "boundary_summary": "两端固支",
    "diagnosis_summary": "外压圆柱壳有限元校核已完成，线性屈曲压力 41.156 MPa；极限压力按“一阶屈曲模态缺陷 Static Riks 最大 LPF × 基准外压”计算，基准外压 40.0 MPa，最大 LPF=0.94922513，得到极限压力 37.969005 MPa，当前结论为“通过”。",
    "analysis_type": "linear_buckling_plus_first_mode_imperfection_riks",
    "user_subroutine_used": false
  },
  "verdict": "通过",
  "surrogate_pressure_error_pct": 181.643,
  "fem_agent_retry_count": 0,
  "task_id": "TASK_25",
  "session_candidate_id": "TMP_5"
}