{
  "case_id": "CASE_7",
  "candidate_id": "C7",
  "display_name": "C7",
  "created_at": "2026-06-27T16:28:14.995483",
  "source": "abaqus_auto",
  "task": {
    "application": "复合材料外压圆柱耐压壳",
    "load_conditions": {
      "type": "external_pressure",
      "label": "外部静水压力",
      "external_pressure_MPa": 30.0
    },
    "boundary_conditions": {
      "type": "END_CLAMPED",
      "label": "两端固支",
      "description": "圆柱耐压壳两端截面平动与转动约束，用于基准外压屈曲与后屈曲校核。",
      "axial_edges": [
        "X0",
        "X1"
      ],
      "radial_constraint": true,
      "rotation_constraint": true
    },
    "geometry_envelope": {
      "length_mm": [
        300.0,
        800.0
      ],
      "radius_mm": [
        80.0,
        180.0
      ],
      "thickness_mm": [
        5.0,
        20.0
      ],
      "alpha_deg": [
        10.0,
        80.0
      ],
      "beta_deg": [
        10.0,
        80.0
      ],
      "imperfection_ratio": [
        0.001,
        0.01
      ]
    },
    "material_system": {
      "name": "T700/Epoxy",
      "density_kg_per_m3": 1550,
      "E1_GPa": 102.0,
      "E2_GPa": 7.0,
      "G12_GPa": 3.35,
      "nu12": 0.16,
      "Xt_MPa": 1400,
      "Xc_MPa": 1050,
      "Yt_MPa": 28,
      "Yc_MPa": 105,
      "S_MPa": 75,
      "material_key": "T700_Epoxy",
      "is_user_specified": false
    },
    "layup_constraints": {
      "allowed_angles": [
        0,
        45,
        -45,
        90
      ],
      "symmetric": true,
      "balanced": true,
      "min_ratio_per_angle": 0.05
    },
    "candidate_generation_preferences": {
      "total_candidates": 8,
      "llm_candidates": null,
      "case_transfer_candidates": null,
      "doe_candidates": null,
      "source_allocation_mode": "ratio_2_1_1"
    },
    "screening_preferences": {
      "top_k_candidates": 3
    },
    "hull_type": "CYLINDRICAL",
    "design_targets": {
      "ultimate_pressure_min_MPa": 35.0,
      "primary_objective": "最小壳体质量"
    }
  },
  "design": {
    "candidate_id": "C7",
    "display_name": "C7",
    "source": "DOE",
    "hull_type": "CYLINDRICAL",
    "geometry": {
      "length_mm": 342.648,
      "radius_mm": 88.381,
      "thickness_mm": 16.719,
      "alpha_deg": 30.161,
      "beta_deg": 75.841,
      "imperfection_ratio": 0.008345
    },
    "layup": {
      "template_name": "NO_OUTER_90",
      "layup": "[(±30.161/±75.841)_10]",
      "skin_layup": "[(±30.161/±75.841)_10]",
      "alpha_deg": 30.161,
      "beta_deg": 75.841,
      "ply_count": 40,
      "angles_deg": [
        30.161,
        -30.161,
        75.841,
        -75.841,
        30.161,
        -30.161,
        75.841,
        -75.841,
        30.161,
        -30.161,
        75.841,
        -75.841,
        30.161,
        -30.161,
        75.841,
        -75.841,
        30.161,
        -30.161,
        75.841,
        -75.841,
        30.161,
        -30.161,
        75.841,
        -75.841,
        30.161,
        -30.161,
        75.841,
        -75.841,
        30.161,
        -30.161,
        75.841,
        -75.841,
        30.161,
        -30.161,
        75.841,
        -75.841,
        30.161,
        -30.161,
        75.841,
        -75.841
      ],
      "skin_f0": 0.0,
      "skin_f45": 0.0,
      "skin_f90": 0.0
    },
    "material_system": {
      "name": "T800G/5228",
      "density_kg_per_m3": 1580.0,
      "E1_GPa": 147.0,
      "E2_GPa": 9.32,
      "G12_GPa": 4.53,
      "nu12": 0.3,
      "Xt_MPa": 2820.0,
      "Xc_MPa": 1538.0,
      "Yt_MPa": 60.2,
      "Yc_MPa": 190.0,
      "S_MPa": 125.0,
      "material_key": "T800G_5228"
    },
    "load_conditions": {
      "type": "external_pressure",
      "label": "外部静水压力",
      "external_pressure_MPa": 30.0
    },
    "boundary_conditions": {
      "type": "END_CLAMPED",
      "label": "两端固支",
      "description": "圆柱耐压壳两端截面平动与转动约束，用于基准外压屈曲与后屈曲校核。",
      "axial_edges": [
        "X0",
        "X1"
      ],
      "radial_constraint": true,
      "rotation_constraint": true
    },
    "design_targets": {
      "ultimate_pressure_min_MPa": 35.0,
      "primary_objective": "最小壳体质量"
    },
    "rule_check": {
      "is_valid": true,
      "errors": [],
      "suggestions": [],
      "details": {
        "length_mm_ok": true,
        "radius_mm_ok": true,
        "thickness_mm_ok": true,
        "alpha_deg_ok": true,
        "beta_deg_ok": true,
        "imperfection_ratio_ok": true,
        "slenderness_ok": true,
        "thickness_radius_ratio_ok": true,
        "imperfection_positive_ok": true,
        "layup_defined": true,
        "ply_count_ok": true,
        "balanced": true,
        "angle_range_ok": true,
        "solver_length_ok": true,
        "solver_radius_ok": true,
        "solver_thickness_ok": true,
        "solver_imperfection_ok": true
      }
    },
    "surrogate_ultimate_pressure_MPa": 148.442,
    "surrogate_PBIPF_MPa": 148.442,
    "surrogate_uncertainty_MPa": 6.111,
    "asme_linear_buckling_pressure_MPa": 239.949,
    "linear_buckling_source": "ASME RD-1172线性屈曲公式",
    "surrogate_weight": 26.416,
    "rationale": "DOE 拉丁超立方探索生成 | 材料=T800G/5228 | 铺层模板=NO_OUTER_90",
    "origin_summary": "",
    "llm_output_excerpt": null,
    "session_candidate_id": "TMP_8"
  },
  "abaqus_results": {
    "candidate_id": "C7",
    "session_candidate_id": "TMP_8",
    "display_name": "C7",
    "status": "success",
    "retry_count": 0,
    "ultimate_pressure_MPa": 297.759563,
    "failure_pressure_MPa": 297.759563,
    "linear_buckling_pressure_MPa": 253.6,
    "first_mode_eigenvalue": 253.6,
    "postbuckling_pressure_MPa": 297.759563,
    "postbuckling_reference_pressure_MPa": 250.0,
    "postbuckling_last_pressure_MPa": 297.759563,
    "riks_lpf_max": 1.19103825,
    "riks_lpf_last": 1.19103825,
    "riks_time_at_lpf_max": 9.01781273,
    "riks_time_last": 9.01781273,
    "imperfection_amplitude_mm": 0.807299473,
    "ultimate_pressure_basis": "一阶屈曲模态缺陷 Static Riks 最大 LPF × 基准外压",
    "failure_mode": "非线性后屈曲极限点",
    "max_displacement_mm": 32.413931,
    "weight_kg_per_m2": 26.41602,
    "verdict": "通过",
    "abaqus_odb": "data\\abaqus_runs\\C7\\C7_post.odb",
    "linear_buckling_odb": "data\\abaqus_runs\\C7\\C7.odb",
    "postbuckling_odb": "data\\abaqus_runs\\C7\\C7_post.odb",
    "abaqus_inp": "data\\abaqus_runs\\C7\\C7.inp",
    "postbuckling_inp": "data\\abaqus_runs\\C7\\C7_post.inp",
    "visualization_json": "data\\abaqus_runs\\C7\\C7_mode1.json",
    "artifact_dir": "data\\abaqus_runs\\C7",
    "error_type": null,
    "error_log": null,
    "mode_eigenvalues": [
      253.6
    ],
    "load_summary": "外部静水压力：p=30.0 MPa",
    "boundary_summary": "两端固支",
    "diagnosis_summary": "外压圆柱壳有限元校核已完成，线性屈曲压力 253.6 MPa；极限压力按“一阶屈曲模态缺陷 Static Riks 最大 LPF × 基准外压”计算，基准外压 250.0 MPa，最大 LPF=1.19103825，得到极限压力 297.759563 MPa，当前结论为“通过”。",
    "analysis_type": "linear_buckling_plus_first_mode_imperfection_riks",
    "user_subroutine_used": false
  },
  "verdict": "通过",
  "surrogate_pressure_error_pct": 50.147,
  "fem_agent_retry_count": 0,
  "task_id": "TASK_41",
  "session_candidate_id": "TMP_8"
}