{
  "case_id": "CASE_5",
  "candidate_id": "C5",
  "display_name": "C5",
  "created_at": "2026-06-27T10:17:29.455467",
  "source": "abaqus_auto",
  "task": {
    "application": "复合材料外压圆柱耐压壳",
    "load_conditions": {
      "type": "external_pressure",
      "label": "外部静水压力",
      "external_pressure_MPa": 30.0
    },
    "boundary_conditions": {
      "type": "END_CLAMPED",
      "label": "两端固支",
      "description": "圆柱耐压壳两端截面平动与转动约束，用于基准外压屈曲与后屈曲校核。",
      "axial_edges": [
        "X0",
        "X1"
      ],
      "radial_constraint": true,
      "rotation_constraint": true
    },
    "geometry_envelope": {
      "length_mm": [
        300.0,
        800.0
      ],
      "radius_mm": [
        80.0,
        180.0
      ],
      "thickness_mm": [
        5.0,
        20.0
      ],
      "alpha_deg": [
        10.0,
        80.0
      ],
      "beta_deg": [
        10.0,
        80.0
      ],
      "imperfection_ratio": [
        0.001,
        0.01
      ]
    },
    "material_system": {
      "name": "T700/Epoxy",
      "density_kg_per_m3": 1550,
      "E1_GPa": 102.0,
      "E2_GPa": 7.0,
      "G12_GPa": 3.35,
      "nu12": 0.16,
      "Xt_MPa": 1400,
      "Xc_MPa": 1050,
      "Yt_MPa": 28,
      "Yc_MPa": 105,
      "S_MPa": 75,
      "material_key": "T700_Epoxy",
      "is_user_specified": true
    },
    "layup_constraints": {
      "allowed_angles": [
        0,
        45,
        -45,
        90
      ],
      "symmetric": true,
      "balanced": true,
      "min_ratio_per_angle": 0.05
    },
    "candidate_generation_preferences": {
      "total_candidates": 10,
      "llm_candidates": null,
      "case_transfer_candidates": null,
      "doe_candidates": null,
      "source_allocation_mode": "ratio_2_1_1"
    },
    "screening_preferences": {
      "top_k_candidates": 5
    },
    "hull_type": "CYLINDRICAL",
    "design_targets": {
      "ultimate_pressure_min_MPa": 35.0,
      "primary_objective": "最小壳体质量"
    }
  },
  "design": {
    "candidate_id": "C5",
    "display_name": "C5",
    "source": "DOE",
    "hull_type": "CYLINDRICAL",
    "geometry": {
      "length_mm": 709.418,
      "radius_mm": 102.562,
      "thickness_mm": 11.191,
      "alpha_deg": 22.504,
      "beta_deg": 23.545,
      "imperfection_ratio": 0.003587
    },
    "layup": {
      "template_name": "BASE_90_AB",
      "layup": "[90_4/(±22.504/±23.545)_8/90_4]",
      "skin_layup": "[90_4/(±22.504/±23.545)_8/90_4]",
      "alpha_deg": 22.504,
      "beta_deg": 23.545,
      "ply_count": 40,
      "angles_deg": [
        90.0,
        90.0,
        90.0,
        90.0,
        22.504,
        -22.504,
        23.545,
        -23.545,
        22.504,
        -22.504,
        23.545,
        -23.545,
        22.504,
        -22.504,
        23.545,
        -23.545,
        22.504,
        -22.504,
        23.545,
        -23.545,
        22.504,
        -22.504,
        23.545,
        -23.545,
        22.504,
        -22.504,
        23.545,
        -23.545,
        22.504,
        -22.504,
        23.545,
        -23.545,
        22.504,
        -22.504,
        23.545,
        -23.545,
        90.0,
        90.0,
        90.0,
        90.0
      ],
      "skin_f0": 0.0,
      "skin_f45": 0.0,
      "skin_f90": 0.2
    },
    "material_system": {
      "name": "T700/Epoxy",
      "density_kg_per_m3": 1550,
      "E1_GPa": 102.0,
      "E2_GPa": 7.0,
      "G12_GPa": 3.35,
      "nu12": 0.16,
      "Xt_MPa": 1400,
      "Xc_MPa": 1050,
      "Yt_MPa": 28,
      "Yc_MPa": 105,
      "S_MPa": 75,
      "material_key": "T700_Epoxy",
      "is_user_specified": true
    },
    "load_conditions": {
      "type": "external_pressure",
      "label": "外部静水压力",
      "external_pressure_MPa": 30.0
    },
    "boundary_conditions": {
      "type": "END_CLAMPED",
      "label": "两端固支",
      "description": "圆柱耐压壳两端截面平动与转动约束，用于基准外压屈曲与后屈曲校核。",
      "axial_edges": [
        "X0",
        "X1"
      ],
      "radial_constraint": true,
      "rotation_constraint": true
    },
    "design_targets": {
      "ultimate_pressure_min_MPa": 35.0,
      "primary_objective": "最小壳体质量"
    },
    "rule_check": {
      "is_valid": true,
      "errors": [],
      "suggestions": [],
      "details": {
        "length_mm_ok": true,
        "radius_mm_ok": true,
        "thickness_mm_ok": true,
        "alpha_deg_ok": true,
        "beta_deg_ok": true,
        "imperfection_ratio_ok": true,
        "slenderness_ok": true,
        "thickness_radius_ratio_ok": true,
        "imperfection_positive_ok": true,
        "layup_defined": true,
        "ply_count_ok": true,
        "balanced": true,
        "angle_range_ok": true,
        "solver_length_ok": true,
        "solver_radius_ok": true,
        "solver_thickness_ok": true,
        "solver_imperfection_ok": true
      }
    },
    "surrogate_ultimate_pressure_MPa": null,
    "surrogate_PBIPF_MPa": null,
    "surrogate_uncertainty_MPa": null,
    "asme_linear_buckling_pressure_MPa": null,
    "linear_buckling_source": null,
    "surrogate_weight": null,
    "rationale": "DOE 拉丁超立方探索生成 | 材料=T700/Epoxy | 铺层模板=BASE_90_AB",
    "origin_summary": "",
    "llm_output_excerpt": null
  },
  "abaqus_results": {
    "candidate_id": "C5",
    "session_candidate_id": null,
    "display_name": null,
    "status": "success",
    "retry_count": 0,
    "ultimate_pressure_MPa": 30.550128,
    "failure_pressure_MPa": 30.550128,
    "linear_buckling_pressure_MPa": 31.485,
    "first_mode_eigenvalue": 31.485,
    "postbuckling_pressure_MPa": 30.550128,
    "postbuckling_reference_pressure_MPa": 30.0,
    "postbuckling_last_pressure_MPa": 29.849913,
    "riks_lpf_max": 1.01833761,
    "riks_lpf_last": 0.99499708,
    "riks_time_at_lpf_max": 6.61781263,
    "riks_time_last": 21.51781273,
    "imperfection_amplitude_mm": 0.387960953,
    "ultimate_pressure_basis": "一阶屈曲模态缺陷 Static Riks 最大 LPF × 基准外压",
    "failure_mode": "非线性后屈曲极限点",
    "max_displacement_mm": 14.137948,
    "weight_kg_per_m2": 17.34605,
    "verdict": "不通过",
    "abaqus_odb": "data\\abaqus_runs\\C5\\C5_post.odb",
    "linear_buckling_odb": "data\\abaqus_runs\\C5\\C5.odb",
    "postbuckling_odb": "data\\abaqus_runs\\C5\\C5_post.odb",
    "abaqus_inp": "data\\abaqus_runs\\C5\\C5.inp",
    "postbuckling_inp": "data\\abaqus_runs\\C5\\C5_post.inp",
    "visualization_json": "data\\abaqus_runs\\C5\\C5_mode1.json",
    "artifact_dir": "data\\abaqus_runs\\C5",
    "error_type": null,
    "error_log": null,
    "mode_eigenvalues": [
      31.485
    ],
    "load_summary": "外部静水压力：p=30.0 MPa",
    "boundary_summary": "两端固支",
    "diagnosis_summary": "外压圆柱壳有限元校核已完成，线性屈曲压力 31.485 MPa；极限压力按“一阶屈曲模态缺陷 Static Riks 最大 LPF × 基准外压”计算，基准外压 30.0 MPa，最大 LPF=1.01833761，得到极限压力 30.550128 MPa，当前结论为“不通过”。",
    "analysis_type": "linear_buckling_plus_first_mode_imperfection_riks",
    "user_subroutine_used": false
  },
  "verdict": "不通过",
  "surrogate_pressure_error_pct": null,
  "fem_agent_retry_count": 0
}